{
  "query_id": "Q-SMOKE-001",
  "question": "2025年9月全国各地区原保险保费收入合计是多少？",
  "query_type": "table_lookup",
  "slots": {
    "agency": null,
    "document_title": "2025年9月全国各地区原保险保费收入情况表",
    "clause_no": null,
    "metric_name": "原保险保费收入合计",
    "period": "2025-09",
    "institution": "全国",
    "unit": "亿元",
    "version_scope": null
  },
  "need_clarification": false,
  "clarification_question": null,
  "is_multi_hop": false,
  "route_plan": [
    "metadata_filter",
    "table_retriever",
    "evidence_gate"
  ],
  "max_hops": 1
}
